{
  "name": "OmniSource - NexaSC",
  "identifier": "com.iamsmmh.omnisource.nexasc",
  "apiVersion": "v2",
  "subtitle": "SoundCloud Go+ unlock and ad removal (unofficial build)",
  "description": "Standalone distribution feed for NexaSC, curated within OmniSource.",
  "iconURL": "https://iamsmmh.github.io/OmniSource/assets/OmniSource.webp",
  "bannerURL": "https://iamsmmh.github.io/OmniSource/assets/OmniSource.png",
  "tintColor": "5B5BD6",
  "website": "https://iamsmmh.github.io/OmniSource/",
  "sourceURL": "https://iamsmmh.github.io/OmniSource/nexasc.json",
  "apps": [
    {
      "name": "NexaSC",
      "bundleIdentifier": "com.soundcloud.TouchApp",
      "developerName": "cielogic & IPA Vault",
      "subtitle": "SoundCloud Go+ unlock and ad removal (unofficial build)",
      "localizedDescription": "NexaSC is a community SoundCloud tweak by cielogic: it unlocks SoundCloud Go+ features, removes ads, adds track downloads and can fetch lyrics automatically (via LRCLIB). The tweak is opened by long-pressing the home icon.",
      "iconURL": "https://iamsmmh.github.io/OmniSource/assets/SoundCloud.webp",
      "tintColor": "FF5500",
      "category": "social",
      "version": "8.77.0",
      "versionDate": "2026-09-07",
      "versionDescription": "SoundCloud 8.77.0 | SoundCloud-8.77.0-NexaSC\n\nIPA Vault build for SoundCloud (NexaSC), version 8.77.0",
      "downloadURL": "https://pub-dd800571175348b6a2745b3396360028.r2.dev/SoundCloud-8.77.0-NexaSC.ipa",
      "size": 107196182,
      "versions": [
        {
          "version": "8.77.0",
          "date": "2026-09-07",
          "localizedDescription": "SoundCloud 8.77.0 | SoundCloud-8.77.0-NexaSC\n\nIPA Vault build for SoundCloud (NexaSC), version 8.77.0",
          "downloadURL": "https://pub-dd800571175348b6a2745b3396360028.r2.dev/SoundCloud-8.77.0-NexaSC.ipa",
          "size": 107196182,
          "minOSVersion": "16.4",
          "releaseUrl": null,
          "source": "altstore",
          "isPrerelease": false,
          "isDraft": false,
          "assets": [
            {
              "filename": "SoundCloud-8.77.0-NexaSC.ipa",
              "downloadUrl": "https://pub-dd800571175348b6a2745b3396360028.r2.dev/SoundCloud-8.77.0-NexaSC.ipa",
              "platform": "ios",
              "architecture": null,
              "fileType": "IPA",
              "size": 107196182,
              "sha256": null,
              "downloads": 0,
              "mimeType": null,
              "installable": true
            }
          ]
        }
      ],
      "screenshotURLs": [],
      "appPermissions": {
        "entitlements": [
          "com.apple.security.application-groups",
          "com.apple.developer.associated-domains",
          "com.apple.developer.coremedia.allow-alternate-video-decoder-selection",
          "com.apple.developer.declared-age-range",
          "com.apple.developer.storekit.request-data",
          "com.apple.developer.device-information.user-assigned-device-name",
          "com.apple.developer.group-session",
          "keychain-access-groups",
          "com.apple.developer.networking.multicast",
          "aps-environment",
          "com.apple.developer.siri",
          "com.apple.developer.networking.wifi-info"
        ],
        "privacy": {
          "NSCameraUsageDescription": "Used to record and upload videos to YouTube.",
          "NSMicrophoneUsageDescription": "Used to record audio for videos.",
          "NSPhotoLibraryUsageDescription": "Used to upload photos and videos from your library.",
          "NSPhotoLibraryAddUsageDescription": "Used to save videos to your photo library.",
          "NSAppleMusicUsageDescription": "Allows access to Apple Music for background playback and media features.",
          "NSBluetoothPeripheralUsageDescription": "Used for connecting to Bluetooth devices.",
          "NSLocalNetworkUsageDescription": "Used to discover and connect to devices on your local network."
        }
      },
      "omnisource": {
        "slug": "nexasc",
        "status": "beta",
        "featured": false,
        "upstreamURL": "",
        "sourceURL": "https://raw.githubusercontent.com",
        "verification": {
          "method": "altstore",
          "publisher": "927tx/IPA-Vault",
          "codeSigned": false,
          "checksumPublished": false
        },
        "compatibility": {
          "minOSVersion": "16.4",
          "maxOSVersion": null,
          "devices": [
            "iphone",
            "ipad"
          ],
          "clients": [
            "altstore",
            "sidestore",
            "feather",
            "esign",
            "livecontainer"
          ],
          "notes": "UNOFFICIAL BUILD. NexaSC has no public repository or developer feed - the only distribution channel is the IPA Vault source, so no developer-published download link exists to verify. Not affiliated with or endorsed by SoundCloud Ltd. Current SoundCloud 8.x builds require iOS 16.4 or newer (a pinned 7.68.1 build for iOS 16.0-16.3 also exists in the vault but is not tracked here). Shares com.soundcloud.TouchApp with TTKillerPlus in this catalog - install one at a time."
        },
        "health": {
          "downloadReachable": true,
          "detail": "HTTP 200",
          "statusSince": "2026-09-10",
          "lastUpdatedAt": "2026-09-07"
        }
      }
    }
  ],
  "news": []
}
