{
  "name": "OmniSource — Aidoku",
  "identifier": "com.iamsmmh.omnisource.aidoku",
  "apiVersion": "v2",
  "subtitle": "Single-app source",
  "description": "Single-app feed for Aidoku.",
  "iconURL": "https://iamsmmh.github.io/OmniSource/assets/Aidoku.webp",
  "tintColor": "5B5BD6",
  "website": "https://iamsmmh.github.io/OmniSource/",
  "sourceURL": "https://iamsmmh.github.io/OmniSource/apps.json",
  "apps": [
    {
      "name": "Aidoku",
      "bundleIdentifier": "app.aidoku.Aidoku",
      "developerName": "Skitty",
      "subtitle": "Free and open-source manga reader",
      "localizedDescription": "Aidoku is a free and open-source manga reader for iOS and iPadOS with no ads and no tracking. Content comes from community-maintained source lists that you add yourself, so nothing is bundled with the app. It downloads chapters for offline reading, syncs library, history and settings through iCloud, supports external trackers, and offers paged, vertical and continuous reading modes with customisable layouts.",
      "iconURL": "https://iamsmmh.github.io/OmniSource/assets/Aidoku.webp",
      "tintColor": "FF375F",
      "category": "other",
      "version": "0.9",
      "versionDate": "2026-09-03",
      "versionDescription": "Aidoku 0.9 | Aidoku\n\n- OCR dictionary support (iOS 18+): import Yomitan-compatible dictionaries in the app and look up words while reading.\n- Suwayomi built-in source: read and track from a Suwayomi instance, just like Komga and Kavita.\n- Auto scroll for webtoon reader: enable and press the play button to scroll without touching your device.\n- Fixed CloudFlare handling: CloudFlare issues that caused external sources to break should be resolved.\n- Overall performance improvements: the library loads much faster (@Amqx), and the webtoon reader was improved.\n- Source stability fixes and disable option: the issue where sources were causing the app to crash should not happen again, and now you can even disable a source that is broken until it receives an update.\n- Many more things: see [the website](https://aidoku.app/release-notes/) for a more complete list.",
      "downloadURL": "https://github.com/Aidoku/Aidoku/releases/download/v0.9/Aidoku.ipa",
      "size": 14731108,
      "versions": [
        {
          "version": "0.9",
          "date": "2026-09-03",
          "localizedDescription": "Aidoku 0.9 | Aidoku\n\n- OCR dictionary support (iOS 18+): import Yomitan-compatible dictionaries in the app and look up words while reading.\n- Suwayomi built-in source: read and track from a Suwayomi instance, just like Komga and Kavita.\n- Auto scroll for webtoon reader: enable and press the play button to scroll without touching your device.\n- Fixed CloudFlare handling: CloudFlare issues that caused external sources to break should be resolved.\n- Overall performance improvements: the library loads much faster (@Amqx), and the webtoon reader was improved.\n- Source stability fixes and disable option: the issue where sources were causing the app to crash should not happen again, and now you can even disable a source that is broken until it receives an update.\n- Many more things: see [the website](https://aidoku.app/release-notes/) for a more complete list.",
          "downloadURL": "https://github.com/Aidoku/Aidoku/releases/download/v0.9/Aidoku.ipa",
          "size": 14731108,
          "minOSVersion": "15.0",
          "releaseUrl": "https://github.com/Aidoku/Aidoku/releases/tag/v0.9",
          "source": "github",
          "isPrerelease": false,
          "isDraft": false,
          "assets": [
            {
              "filename": "Aidoku.ipa",
              "downloadUrl": "https://github.com/Aidoku/Aidoku/releases/download/v0.9/Aidoku.ipa",
              "platform": "ios",
              "architecture": null,
              "fileType": "IPA",
              "size": 14731108,
              "sha256": "86405861d3a0c90876a90aa1ca668bee54f4555a56249fede4444be5382833e8",
              "downloads": 1835,
              "mimeType": "application/octet-stream",
              "installable": true
            }
          ],
          "sha256": "86405861d3a0c90876a90aa1ca668bee54f4555a56249fede4444be5382833e8",
          "downloads": 1835
        }
      ],
      "screenshotURLs": [
        "https://aidoku.app/images/library.png",
        "https://aidoku.app/images/source.png",
        "https://aidoku.app/images/reader.png"
      ],
      "omnisource": {
        "slug": "aidoku",
        "status": "stable",
        "featured": false,
        "upstreamURL": "https://github.com/Aidoku/Aidoku",
        "sourceURL": "https://github.com/Aidoku/Aidoku",
        "verification": {
          "method": "github-release",
          "publisher": "Aidoku/Aidoku",
          "codeSigned": false,
          "checksumPublished": false
        },
        "compatibility": {
          "minOSVersion": "15.0",
          "maxOSVersion": null,
          "devices": [
            "iphone",
            "ipad"
          ],
          "clients": [
            "altstore",
            "sidestore",
            "feather",
            "esign",
            "livecontainer"
          ],
          "notes": "Official releases from Aidoku/Aidoku. Sources are added by the user; the app ships none."
        },
        "health": {
          "downloadReachable": true,
          "detail": "HTTP 302",
          "statusSince": "2026-09-07",
          "lastUpdatedAt": "2026-09-03"
        }
      }
    }
  ],
  "news": []
}
