{
  "name": "OmniSource — Conduit",
  "identifier": "com.iamsmmh.omnisource.conduit",
  "apiVersion": "v2",
  "subtitle": "Single-app source",
  "description": "Single-app feed for Conduit.",
  "iconURL": "https://iamsmmh.github.io/OmniSource/assets/Conduit.webp",
  "tintColor": "5B5BD6",
  "website": "https://iamsmmh.github.io/OmniSource/",
  "sourceURL": "https://iamsmmh.github.io/OmniSource/apps.json",
  "apps": [
    {
      "name": "Conduit",
      "bundleIdentifier": "app.cogwheel.conduit",
      "developerName": "cogwheel0",
      "subtitle": "Native client for Open WebUI & Ollama",
      "localizedDescription": "Conduit is a native, open-source iOS and Android client for Open WebUI, direct OpenAI-compatible endpoints, Ollama and Hermes. Chat with your own self-hosted local models or API-backed ones with a polished SwiftUI interface — conversations stay in sync, code blocks render properly, and your data never touches a third-party server.",
      "iconURL": "https://iamsmmh.github.io/OmniSource/assets/Conduit.webp",
      "tintColor": "7794F0",
      "category": "utilities",
      "version": "4.1.4",
      "versionDate": "2026-09-01",
      "versionDescription": "Conduit 4.1.4 | conduit\n\n## What's Changed\n* Support Open WebUI v0.11.3 by @cogwheel0 in https://github.com/cogwheel0/conduit/pull/696\n\n\n**Full Changelog**: https://github.com/cogwheel0/conduit/compare/v4.1.3...v4.1.4",
      "downloadURL": "https://github.com/cogwheel0/conduit/releases/download/v4.1.4/conduit.ipa",
      "size": 35794270,
      "versions": [
        {
          "version": "4.1.4",
          "date": "2026-09-01",
          "localizedDescription": "Conduit 4.1.4 | conduit\n\n## What's Changed\n* Support Open WebUI v0.11.3 by @cogwheel0 in https://github.com/cogwheel0/conduit/pull/696\n\n\n**Full Changelog**: https://github.com/cogwheel0/conduit/compare/v4.1.3...v4.1.4",
          "downloadURL": "https://github.com/cogwheel0/conduit/releases/download/v4.1.4/conduit.ipa",
          "size": 35794270,
          "minOSVersion": "16.0",
          "releaseUrl": "https://github.com/cogwheel0/conduit/releases/tag/v4.1.4",
          "source": "github",
          "isPrerelease": false,
          "isDraft": false,
          "assets": [
            {
              "filename": "app-arm64-v8a-release.apk",
              "downloadUrl": "https://github.com/cogwheel0/conduit/releases/download/v4.1.4/app-arm64-v8a-release.apk",
              "platform": "android",
              "architecture": "arm64",
              "fileType": "APK",
              "size": 77845591,
              "sha256": "1ff55c963065c4e5ccc1ff8f31e36eacc35f4faf8bf851693199e3bfd1cff356",
              "downloads": 1594,
              "mimeType": "application/vnd.android.package-archive",
              "installable": true
            },
            {
              "filename": "app-armeabi-v7a-release.apk",
              "downloadUrl": "https://github.com/cogwheel0/conduit/releases/download/v4.1.4/app-armeabi-v7a-release.apk",
              "platform": "android",
              "architecture": "armv7",
              "fileType": "APK",
              "size": 70339387,
              "sha256": "31d949c6ef86dc8553ce7ab4a794a393096c95dd77c7074a9faaf36e643254ca",
              "downloads": 19,
              "mimeType": "application/vnd.android.package-archive",
              "installable": true
            },
            {
              "filename": "app-release.aab",
              "downloadUrl": "https://github.com/cogwheel0/conduit/releases/download/v4.1.4/app-release.aab",
              "platform": "android",
              "architecture": null,
              "fileType": "AAB",
              "size": 172108069,
              "sha256": "17d0254647ff56e6bf823da9227c7efd929e47af1d907d3267f5d4a48a323f42",
              "downloads": 7,
              "mimeType": "raw",
              "installable": true
            },
            {
              "filename": "app-x86_64-release.apk",
              "downloadUrl": "https://github.com/cogwheel0/conduit/releases/download/v4.1.4/app-x86_64-release.apk",
              "platform": "android",
              "architecture": "x86_64",
              "fileType": "APK",
              "size": 83720927,
              "sha256": "5a5f0f7c21b936f804e684ff4411a8ee94c3131d6ceb10be9db50922ea69b4c0",
              "downloads": 14,
              "mimeType": "application/vnd.android.package-archive",
              "installable": true
            },
            {
              "filename": "conduit.ipa",
              "downloadUrl": "https://github.com/cogwheel0/conduit/releases/download/v4.1.4/conduit.ipa",
              "platform": "ios",
              "architecture": null,
              "fileType": "IPA",
              "size": 35794270,
              "sha256": "8657f3cbe68a00f6b965581ccbd417f42ff525823c80335e5e8efdb5e371d811",
              "downloads": 103,
              "mimeType": "raw",
              "installable": true
            }
          ],
          "sha256": "8657f3cbe68a00f6b965581ccbd417f42ff525823c80335e5e8efdb5e371d811",
          "downloads": 103
        }
      ],
      "screenshotURLs": [],
      "omnisource": {
        "slug": "conduit",
        "status": "stable",
        "featured": false,
        "upstreamURL": "https://github.com/cogwheel0/conduit",
        "sourceURL": "https://github.com/cogwheel0/conduit",
        "verification": {
          "method": "github-release",
          "publisher": "cogwheel0/conduit",
          "codeSigned": false,
          "checksumPublished": false
        },
        "compatibility": {
          "minOSVersion": "16.0",
          "maxOSVersion": null,
          "devices": [
            "iphone",
            "ipad"
          ],
          "clients": [
            "altstore",
            "sidestore",
            "feather",
            "esign",
            "livecontainer"
          ],
          "notes": "Official IPA (conduit.ipa) from the developer's GitHub releases; the debug-flavored bundle (app.cogwheel.conduit.debug) is excluded. Requires a self-hosted Open WebUI/Ollama server or your own API endpoints."
        },
        "health": {
          "downloadReachable": true,
          "detail": "HTTP 302",
          "statusSince": "2026-09-10",
          "lastUpdatedAt": "2026-09-01"
        }
      }
    }
  ],
  "news": []
}
