{
  "name": "OmniSource - qBitConnect",
  "identifier": "com.iamsmmh.omnisource.qbitconnect",
  "apiVersion": "v2",
  "subtitle": "Modern qBittorrent remote client",
  "description": "Standalone distribution feed for qBitConnect, curated within OmniSource.",
  "iconURL": "https://iamsmmh.github.io/OmniSource/assets/OmniSource.webp",
  "bannerURL": "https://iamsmmh.github.io/OmniSource/assets/OmniSource.png",
  "tintColor": "5B5BD6",
  "website": "https://iamsmmh.github.io/OmniSource/",
  "sourceURL": "https://iamsmmh.github.io/OmniSource/qbitconnect.json",
  "apps": [
    {
      "name": "qBitConnect",
      "bundleIdentifier": "com.bluematter.qbitconnect",
      "developerName": "Rajnish Sharma",
      "subtitle": "Modern qBittorrent remote client",
      "localizedDescription": "qBitConnect is a modern, open-source qBittorrent remote client for iPhone and iPad built with Flutter. Connect to your qBittorrent WebUI to add, manage and monitor torrents with a clean, adaptive interface, push notifications for finished downloads, RSS support and quick actions.",
      "iconURL": "https://iamsmmh.github.io/OmniSource/assets/qBitConnect.webp",
      "tintColor": "3875C5",
      "category": "utilities",
      "version": "1.6.6",
      "versionDate": "2025-11-02",
      "versionDescription": "qBitConnect 1.6.6 | qBitConnect\n\nThis release includes:\n• Minor improvements and bug fixes\n• UI Enhancements",
      "downloadURL": "https://github.com/RajnishOne/qbitconnect/releases/download/v1.6.6/qBitConnect.ipa",
      "size": 11798221,
      "versions": [
        {
          "version": "1.6.6",
          "date": "2025-11-02",
          "localizedDescription": "qBitConnect 1.6.6 | qBitConnect\n\nThis release includes:\n• Minor improvements and bug fixes\n• UI Enhancements",
          "downloadURL": "https://github.com/RajnishOne/qbitconnect/releases/download/v1.6.6/qBitConnect.ipa",
          "size": 11798221,
          "minOSVersion": "15.0",
          "releaseUrl": "https://github.com/RajnishOne/qbitconnect/releases/tag/v1.6.6",
          "source": "github",
          "isPrerelease": false,
          "isDraft": false,
          "assets": [
            {
              "filename": "qBitConnect.aab",
              "downloadUrl": "https://github.com/RajnishOne/qbitconnect/releases/download/v1.6.6/qBitConnect.aab",
              "platform": "android",
              "architecture": null,
              "fileType": "AAB",
              "size": 49083912,
              "sha256": "cb8ca5ae308320f78e7e1a7d8603d3e8505f2c21d2f396b5fd4a877067de2932",
              "downloads": 4,
              "mimeType": "binary/octet-stream",
              "installable": true
            },
            {
              "filename": "qBitConnect.apk",
              "downloadUrl": "https://github.com/RajnishOne/qbitconnect/releases/download/v1.6.6/qBitConnect.apk",
              "platform": "android",
              "architecture": null,
              "fileType": "APK",
              "size": 60951407,
              "sha256": "dceba7fad7ebd661d57c821f6dd76aa34740edc02dc721b001d80c466dcdfbf8",
              "downloads": 132,
              "mimeType": "application/vnd.android.package-archive",
              "installable": true
            },
            {
              "filename": "qBitConnect.ipa",
              "downloadUrl": "https://github.com/RajnishOne/qbitconnect/releases/download/v1.6.6/qBitConnect.ipa",
              "platform": "ios",
              "architecture": null,
              "fileType": "IPA",
              "size": 11798221,
              "sha256": "683361416e6816c167f4dd72b5d4742a59c3a10faaa0823f8c5ec0754ba941c4",
              "downloads": 35,
              "mimeType": "binary/octet-stream",
              "installable": true
            }
          ],
          "sha256": "683361416e6816c167f4dd72b5d4742a59c3a10faaa0823f8c5ec0754ba941c4",
          "downloads": 35
        }
      ],
      "screenshotURLs": [],
      "omnisource": {
        "slug": "qbitconnect",
        "status": "stable",
        "featured": false,
        "upstreamURL": "https://github.com/RajnishOne/qbitconnect",
        "sourceURL": "https://github.com/RajnishOne/qbitconnect",
        "verification": {
          "method": "github-release",
          "publisher": "RajnishOne/qbitconnect",
          "codeSigned": false,
          "checksumPublished": false
        },
        "compatibility": {
          "minOSVersion": "15.0",
          "maxOSVersion": null,
          "devices": [
            "iphone",
            "ipad"
          ],
          "clients": [
            "altstore",
            "sidestore",
            "feather",
            "esign",
            "livecontainer"
          ],
          "notes": "Official IPAs from the developer's own GitHub releases (iOS 15+ per the Xcode project). The developer's AltStore PAL source may carry newer builds from a separate pipeline; this feed tracks the signed-off GitHub release tags."
        },
        "health": {
          "downloadReachable": true,
          "detail": "HTTP 302",
          "statusSince": "2026-09-10",
          "lastUpdatedAt": "2025-11-02"
        }
      }
    }
  ],
  "news": []
}
