{
  "name": "OmniSource - uPro Plus",
  "identifier": "com.iamsmmh.omnisource.youmod",
  "apiVersion": "v2",
  "subtitle": "YouTube 21.37.4 extra-tweaks build (YouMod + player stack)",
  "description": "Standalone distribution feed for uPro Plus, curated within OmniSource.",
  "iconURL": "https://iamsmmh.github.io/OmniSource/assets/OmniSource.webp",
  "bannerURL": "https://iamsmmh.github.io/OmniSource/assets/OmniSource.png",
  "tintColor": "5B5BD6",
  "website": "https://iamsmmh.github.io/OmniSource/",
  "sourceURL": "https://iamsmmh.github.io/OmniSource/youmod.json",
  "apps": [
    {
      "name": "uPro Plus",
      "bundleIdentifier": "com.google.ios.youtube",
      "developerName": "Tonwalter888",
      "subtitle": "YouTube 21.37.4 extra-tweaks build (YouMod + player stack)",
      "localizedDescription": "uPro Plus is OmniSource's featured YouTube 21.37.4 extra-tweaks IPA. It is the YouProEXTRA YouMod 2.0.0 line on YouTube 21.37.4 with the extra player stack that release publishes: YouPip (Picture-in-Picture), YouQuality and YouChooseQuality, YTHoldForSpeed, YouGetCaption, YTABConfig, YTNativeShare, YTweaks, Return YouTube Dislike, DontEatMyContent, Gonerino, VolumeBoostYT and PleaseDontStopTheMusic. 120 Hz display refresh is used when the device supports it. Native 4K is available on A16+ devices; YTUHD is not bundled on this YouTube version. Requires iOS 17.0+. Shares com.google.ios.youtube with the other YouTube mods: install one at a time. YTLite, YTKACE and YouMod are competing main tweaks; stacking all three in one IPA is unstable, so this listing follows the extra-tweaks YouMod 21.37.4 release.",
      "iconURL": "https://iamsmmh.github.io/OmniSource/assets/YouTube.webp",
      "tintColor": "FF0000",
      "category": "photo-video",
      "version": "21.38.3",
      "versionDate": "2026-09-26",
      "versionDescription": "YouTube 21.38.3 | uPro Plus extra tweaks | YouMod_21.38.3_2.0.0\n\n### Latest Release, ENJOY!!\n\n> [!NOTE]\n> - **YTUHD** is not included.\n> - [v2.0.0 release notes](https://github.com/Tonwalter888/YouMod/releases/tag/v2.0.0)\n> - no standalone iSponsorBlock. (unstable in newer builds)\n> - - -\n> #### Extra Tweaks:\n> - `YouPip` `YTABConfig` `YouQuality` `YouChooseQuality`  `YouGetCaption` `YTHoldForSpeed` `YTNativeShare` `YTweaks`\n> -  `Return-YouTube-Dislikes` `DontEatMyContent` `Open in YouTube (Safari Extension)` `Gonerino` `VolumeBoostYT` `PleaseDontStopTheMusic`\n\n> [!WARNING]\n> - Extra tweaks that are bundled may be unstable on newer versions.\n\n> [!WARNING]\n> - 21.34.3+ builds require iOS 17+ now.",
      "downloadURL": "https://github.com/mrdrvt99/YouProEXTRA/releases/download/youmod-ipa1/YouMod_21.38.3_2.0.0.ipa",
      "size": 130002394,
      "versions": [
        {
          "version": "21.38.3",
          "date": "2026-09-26",
          "localizedDescription": "YouTube 21.38.3 | uPro Plus extra tweaks | YouMod_21.38.3_2.0.0\n\n### Latest Release, ENJOY!!\n\n> [!NOTE]\n> - **YTUHD** is not included.\n> - [v2.0.0 release notes](https://github.com/Tonwalter888/YouMod/releases/tag/v2.0.0)\n> - no standalone iSponsorBlock. (unstable in newer builds)\n> - - -\n> #### Extra Tweaks:\n> - `YouPip` `YTABConfig` `YouQuality` `YouChooseQuality`  `YouGetCaption` `YTHoldForSpeed` `YTNativeShare` `YTweaks`\n> -  `Return-YouTube-Dislikes` `DontEatMyContent` `Open in YouTube (Safari Extension)` `Gonerino` `VolumeBoostYT` `PleaseDontStopTheMusic`\n\n> [!WARNING]\n> - Extra tweaks that are bundled may be unstable on newer versions.\n\n> [!WARNING]\n> - 21.34.3+ builds require iOS 17+ now.",
          "downloadURL": "https://github.com/mrdrvt99/YouProEXTRA/releases/download/youmod-ipa1/YouMod_21.38.3_2.0.0.ipa",
          "size": 130002394,
          "minOSVersion": "17.0",
          "releaseUrl": "https://github.com/mrdrvt99/YouProEXTRA/releases/tag/youmod-ipa1",
          "source": "github",
          "isPrerelease": false,
          "isDraft": false,
          "assets": [
            {
              "filename": "YouMod_21.38.3_2.0.0.ipa",
              "downloadUrl": "https://github.com/mrdrvt99/YouProEXTRA/releases/download/youmod-ipa1/YouMod_21.38.3_2.0.0.ipa",
              "platform": "ios",
              "architecture": null,
              "fileType": "IPA",
              "size": 130002394,
              "sha256": "7dfa3891767a313f0b5bf88d5f0b035c65c91f963b329df2b31baf796c27a7b9",
              "downloads": 16,
              "mimeType": "application/octet-stream",
              "installable": true
            }
          ],
          "sha256": "7dfa3891767a313f0b5bf88d5f0b035c65c91f963b329df2b31baf796c27a7b9",
          "downloads": 16
        }
      ],
      "screenshotURLs": [],
      "appPermissions": {
        "entitlements": [
          "com.apple.security.application-groups",
          "com.apple.developer.associated-domains",
          "com.apple.developer.coremedia.allow-alternate-video-decoder-selection",
          "com.apple.developer.declared-age-range",
          "com.apple.developer.storekit.request-data",
          "com.apple.developer.device-information.user-assigned-device-name",
          "com.apple.developer.group-session",
          "keychain-access-groups",
          "com.apple.developer.networking.multicast",
          "aps-environment",
          "com.apple.developer.siri",
          "com.apple.developer.networking.wifi-info"
        ],
        "privacy": {
          "NSCameraUsageDescription": "Used to record and upload videos to YouTube.",
          "NSMicrophoneUsageDescription": "Used to record audio for videos.",
          "NSPhotoLibraryUsageDescription": "Used to upload photos and videos from your library.",
          "NSPhotoLibraryAddUsageDescription": "Used to save videos to your photo library.",
          "NSAppleMusicUsageDescription": "Allows access to Apple Music for background playback and media features.",
          "NSBluetoothPeripheralUsageDescription": "Used for connecting to Bluetooth devices.",
          "NSLocalNetworkUsageDescription": "Used to discover and connect to devices on your local network."
        }
      },
      "omnisource": {
        "slug": "youmod",
        "status": "stable",
        "featured": true,
        "upstreamURL": "https://github.com/Tonwalter888/YouMod",
        "sourceURL": "https://github.com/mrdrvt99/YouProEXTRA",
        "verification": {
          "method": "github-release",
          "publisher": "mrdrvt99/YouProEXTRA",
          "codeSigned": false,
          "checksumPublished": false
        },
        "compatibility": {
          "minOSVersion": "17.0",
          "maxOSVersion": null,
          "devices": [
            "iphone",
            "ipad"
          ],
          "clients": [
            "altstore",
            "sidestore",
            "flarestore",
            "feather",
            "esign",
            "ksign",
            "livecontainer"
          ],
          "notes": "Requires iOS 17.0+ (YouTube 21.34.3+). Served from mrdrvt99/YouProEXTRA tags youmod-ipa* (YouMod_21.37.4_2.0.0 extra-tweaks IPA). Catalog name is uPro Plus; slug remains youmod for stable feed URLs. Shares com.google.ios.youtube with the other YouTube mods: install one at a time."
        },
        "health": {
          "downloadReachable": true,
          "detail": "HTTP 302",
          "statusSince": "2026-09-07",
          "lastUpdatedAt": "2026-09-26"
        }
      }
    }
  ],
  "news": []
}
